S.No.,User_query,Bot_reply,Relevant
0,abd villiers aur virat kohli me kaun best hai?,I cannot interpret that.Please ask me anything about real estate.,No
1,I want a place to live in Gurgaon.,"Sure, do you have a particular area in mind?",Yes
2,Show me the weather in Gurgaon.,We don't have that facility right now.,No
3,Can you show me a place where I can play tennis?,"Yeah,sure.",Yes
4,Hello there.How can you help me?,Hi ! I can help you find places to rent or purchase in Gurgaon.,Yes
5,abds eijf  oeljd,"Sorry,I cannot interpret that.Please ask me about real estate projects.",No
6,I am looking for a 2BHK apartment ,"Great, are you looking to rent or buy the apartment?",Yes
7,I want to rent ,Do you have a locality or project in mind?,Yes
8,Want to buy a 4BHK on Sohna Road,"Great, do you have a budget in mind?",Yes
9,Do you have properties on Golf Course Road?,"Yes, we have a number of properties at your location of choice. Are you looking to buy or rent?",Yes
10,What areas do you have in Gurgaon?,"We have six localities you can chose from: Sohna Road, Golf Course Road, Golf Course Extension Road, Dwarka Expressway, New Gurgaon and M.G Road. Which locality are you interested in?",Yes
11,Do you have properties to rent or buy?,We have properties to rent and buy. What are you looking for?,Yes
12,"I want a penthouse, what is the price?","The price will depend on the locality and project, do you have this is mind?",Yes
13,I need a PG place on Golf Course Extension,"I am sorry, we are not currently able to provide this information. ",Yes
14,"Can I rent a 2BHK for 30,000?",We have a number of 2BHK apartments within this budget. Which locality are you looking for?,Yes
15,What is the weather like in Gurgaon?,"I am sorry, we are not currently able to provide this information. Please ask me about real estate projects. ",No
16,Do you only have properties in Gurgaon?,"Yes, at the moment. However, we are working on expanding this. Watch this space!",Yes
17,I want an apartment in Shispal Vihar.,"Great, do you have a budget in mind?",Yes
18,I want to see apartments available by DLF.,"Sure, we have a number of apartments. Do you have a locality in mind?",Yes
19,I need a Vipul Group apartment on Golf Course Road ,"Great, we have information on apartments that match your choice. Do you have a budget in mind?",Yes
20,I want an apartment near Heritage School.,There are property options availabe that suit your requirement. Do you have a budget or project in mind?,Yes
21,"I want an apartment with a swimming pool, budget of 50,000","Great, do you have a locality or project in mind?",Yes
22,I want an apartment with a clubhouse which has a gym on M.G. Road,"Okay, there are property options available that meet your needs. Do you have a budget in mind?",Yes
23,How many projects are there in Gurgaon?,We currently have multiple projects in Gurgaon. Can we help you find a place?,Yes
24,How many under construction projects have DLF got?,There are multiple under construction projects available under your preffered developer. Are you looking for a place to buy?,Yes
25,I want an apartment. Can you show me ones on M.G Road?,"Yes, we have multiple property options to choose from. Are you looking to buy or rent?",Yes
26,I need help. Can you help me?,"Yes, of course. Are you looking to buy or rent a property?",Yes
27,I want to buy. Can you also show me places in New Gurgaon?,"Yes, of course. We have multiple property options to choose from. Do you have a budget in mind?",Yes
28,I want a place in Pune. Can you show me these?,"Unfortunately, we do not have information for Pune at this stage. Can I help you with anything in Gurgaon?",No
29,"I want a place to buy. How many places do you have above 70,000?",We have multiple property options to choose from in Gurgaon. Do you have a locality or project in mind?,Yes
30,I am tired ,I am sorry I am not able to interpret that. Please ask me something else.,No
31,Can someone from your team call me?,"I am sorry we do not offer that facility. However, please view our contact us page to get in touch with us.",No
32,Do you have any jobs?,"I am unable to answer that question, please contact us to speak to someone in the team. ",No
33,Is Emaar a good developer?,"We provide an efficient review and rating system, you can view this for all your preferred projects in Gurgaon.",No
34,I am hot ,I am sorry I am not able to interpret that. Please ask me something else.,No
35,Do most projects have worker clearance? ,We have multiple projects in Gurgaon that offer this facility. Do you have a locality in mind?,Yes
36,I want an apartment in GGN,Do you have any area in your mind?,Yes
37,I want a flat in gurugram,"Yeah, sure. Any particular area?",Yes
38,Spacious apartment in GGN,Okay. Do you have a budget in mind?,Yes
39,I want an apartment in ggn with a great golf course.,Sure. Do you have any particular area in mind?,Yes
40,I want an apartment near Sohna Road,"Yes, Do you have any preferred developer?",Yes
41,I want to buy an apartment which is under construction.,Do you have any area in your mind?,Yes
42,"Hey, can you help me out?","Hey,what are you looking for?",Yes
43,I want an office space on Sohna road.,"I am sorry, we currently cover only residential spaces.",Yes
44,Can you suggest some good brokers to find a flat on M.G.Rad?,I am sorry. We don’t deal with brokers.,Yes
45,Do you deliver food too?,"Sorry,I cannot interpret that.Please ask me about real estate projects.",No
46,I want a place to stay in Delhi,I am sorry. We currently cover only Gurgaon. Can I help you with anything in Gurgaon?,Yes
47,Can you suggest a society with good sports facilities?,"Yes, sure. Do you have any area in mind?",Yes
48,I want an aparmtent in Delhi NCR.,We currently cover only Gurgaon under NCR.,Yes
49,Who are the top developers in Gurgaon?,We provide an efficient rating and review system for all developers in Gurgaon.,Yes
50,I want an apartment in Vipul Greens,Great. What property type are you looking for?,Yes
51,I am hungry,"I am sorry, I am not able to interpret that. Please ask me something else.",No
52,abcd efgh ijkl mnop,"Sorry, I cannot interpret that.Please ask me about real estate projects.",No
53,"Does ABW La Lagune
 provide Power Backup?",Let me check that for you.,Yes
54,Show me user reviews for Adani aangan.,Your choice of property has the following user reviews for you to see.,Yes
55,"Show me fully furnished, ready to move in apartments in GGN",Okay. Do you have an area in mind?,Yes
56,I have 3 dogs. Show me societies that are pet friendly.,Okay. What areas in Gurgaon would be of your preferance?,Yes
57,What are the best schools available near Adani oyster grande?,These schools are available near your chosen society. ,Yes
58,"What are the best hospitals available near Gurgaon one
?",These hospitals are available near your chosen society. ,Yes
59,What are the markets available near Antriksh zeal?,These markets are available near your chosen society. ,Yes
60,What are the best gyms available near Ansal housing Highland park?,These gyms are available near your chosen society. ,Yes
61,How far is Ansal API estella from the nearest Metro Station?,Calculating distance from your choice of location to the nearest metro station...,Yes
62,How far is Ansals amantre from the nearest Railway Station?,Calculating distance from your choice of location to the nearest railway station...,Yes
63,How far is Antriksh Heights from the Domestic Airport?,Calculating distance from your choice of location to the nearest domestic airport...,Yes
64,What is the nearest bus-stand from Aashiana The center court?,Let me look for the nearest bus-stand from your loction of choice.,Yes
65,What are the nearest Malls around Assotech Breeze?,Let me find the best malls avilable near your chosen society.,Yes
66,How far is the nearest petrol station from Assotech Blith?,Calculating distance from your choice of location to the nearest petrol station...,Yes
67,How far is ATS Kocoon from the Expressway?,Calculating distance from your choice of location to the Expressway...,Yes
68,I want a 3BHK Gurgaon which is Vastu Compliant,Great choice! What area or locality do you have in mind?,Yes
69,How many ATMs are available inside ATS Tourmaline?,Let me find that out for you.,Yes
70,Looking for a Society in GGN which provides Day Care Services,There are multiple societies which cater to this requirement. What area do you have in mind?,Yes
71,Does ATS triumph provide Laundry Services?,Let me find out whether your chosen society provides the required service.,Yes
72,What societies in GGN provide the best security?,We provide property listings aided by genuine user reviews and ratings. What area or locality do you have in mind?,Yes
73,Show me societies which provide multiple parking spaces per apartment.,Let me find out the societies that provide the required service. What area or locality do you have in mind?,Yes
74,Does ATS Tangerine have a Squash Court?,Let me check that for you.,Yes
75,I have a 2BHK in ATS Tangerine. I wish to put it on rent. Find me prospective buyers,"Sorry, we do not provide that facility. I can help you with renting or buying property. ",No
76,I want to sell my apartment which is in ATS Triumph. ,"Sorry, we do not provide that facilty. I can help you with renting or buying property.",No
77,Find apartment sharing options in GGN for bachelors ,"Sorry, we do not provide that facility. I can help you with renting or buying property.",No
78,I want an apartment near my office.,Sure. Are you looking to rent or buy an apartment?,Yes
79,Hi,"Hello there, how can I help you?",Yes
80,"Looking for an apartment to rent on M.G. Road within 40,000. ",Alright. What kind of an apartment are you looking for?,Yes
81,"A 3 bedroom house on M.G. Road within 40,000",Let me show you the societies which provide apartments suitable to you at your preferred location.,Yes
82,What are the best underconstruction projects in GGN to invest in?,Let me show you the top rated properties under construction to invest in. ,Yes
83,Restart,"Hello there, how can I help you?",Yes
84,Can you help me schedule a visit to AWHO Sispal Vihar?,"Sorry, we do not provide that facility. I can help you with renting or buying property.",No
85,How far is the nearest police station from Central Park I?,Let me find out the nearest police station from your choice of location.,Yes
86,What are the nearest banks around Bestech park View City 1?,Let me search for the required information,Yes
87,Give me the configuration of a 2BHK apartment in Bestech Park view ananda.,Looking for information on the selected property...,Yes
88,What are the best sports and recreational clubs around BTPL Beverly towers?,Let me look for the best options available near your choice of location.,Yes
89,How long will it take from BTPL Beverly towers to reach the nearest club?,Calculating the time taken to travel from your chosen location to the nearest club...,Yes
90,What are the best Cinemas around BPTP Park Prime?,Let me look for the best options available near your choice of location.,Yes
91,How far is PVR from BPTP Park Prime?,Please wait while I generate the required information.,Yes
92,Cinemas near BPTP Park Prime,Let me look for the best options available near your choice of location.,Yes
93,How long will it take from BPTP Park Prime to reach PVR Cinemas?,Let me calculate that for you,Yes
94,What are the nearest Cinemas around BPTP Park Prime?,Let me look for the best options available,Yes
95,Are there any good pre-schools available inside BPTP spacio?,"Yes, let me show you the best options available of your choice of service.",Yes
96,Pre-schools around BPTP spacio,Let me show you a listing of the best options available of your choice of service.,Yes
97,What are the nearest pre-schools around BPTP spacio?,Let me show you the best options available of your choice of service.,Yes
98,How far is BPTP spacio from the nearest Pre-School?,Calculating the distance from your choice of location to the nearest pre-school...,Yes
99,How long will it take from BPTP spacio to reach the nearest pre-School?,Let me calculate that for you,Yes
100,What are the most prominent pre-schools available near BPTP spacio?,Let me show you the best options available of your choice of service.,Yes
101,What are the nearest day-care centers around BPTP Park Serene?,Let me look up the best options available of your choice of service.,Yes
102,What are the most prominent day-care centers available near BPTP Park Serene?,Let me find out the best options available of your choice of service.,Yes
103,Are there any Day care centers available inside BPTP Park Serene?,Hold on as I enquire about your choice of service.,Yes
104,Day-care centers around BPTP Park Serene,Let me show you the best options available of your choice of service.,Yes
105,Show me user ratings for Day Care Centers inside BPTP Park Serene.,Roofpik provides an efficient system of user reviews and ratings for you to make the best decision. Here are the user reviews of your service of choice.,Yes
106,What are the nearest supermarkets available around BPTP Amstoria?,Let me show you the best options available of your choice of service.,Yes
107,Super markets around BPTP Amstoria,Let me show you the best options available near your choice of location.,Yes
108,How far is BPTP Amstoria from the nearest supermarket?,Calculating distance from your choice of location to the nearest super market...,Yes
109,What is the biggest supermarket near BPTP Amstoria?,Let me look that up for you,Yes
110,What are the nearest parlours available around BPTP Park Generations?,Showing you the best options available of your choice of service...,Yes
111,Are there any parlours available inside BPTP Park Generations?,Let me find that out for you,Yes
112,Show me user reviews for parlours available inside BPTP Park Generations.,Roofpik provides an efficient system of user reviews and ratings for you to make the best decision. Here are the user reviews of your service of choice.,Yes
113,Best parlours near BPTP Park Generations,Showing you the best options available of your choice of service.,Yes
114,What are the nearest pharmacies available around BPTP terra?,Let me look for the best options available of your choice of service.,Yes
115,Are there any pharmacies available inside BPTP terra?,Let me find out the information that you require.,Yes
116,Pharmacies around BPTP terra,Let me show you the best options available of your choice of service.,Yes
117,Most conveniently accessible pharmacies for BPTP terra residents.,The best options available of your choice of service are listed below.,Yes
118,What are the top rated restaurants around BPTP Chateue?,Let me show you the best options available of your choice of service.,Yes
119,How far is BPTP Chateue from Wendy’s?,Let me calculate the required distance for you.,Yes
120,Best diners around BPTP Chateue,Let me show you the best options available.,Yes
121,Are there any restaurants available inside BPTP Chateue?,Let me locate the services required by you.,Yes
122,How far is BPTP Park Prime Mansions from the fire station?,Calculating the distance from your choice of location to the nearest fire station.,Yes
123,Fire station near BPTP Park Prime Mansions,Looking for the required service near your location of choice.,Yes
124,Are there any fire stations near BPTP Park Prime Mansions?,Hold on as I look for the required service near your choice of location.,Yes
125,How long will it take from Brisk Lumbini Terrace Homes to reach the nearest Metro Station at peak-time?,Calculating the desired information...,Yes
126,How long will it take from Brisk Lumbini Terrace Homes to reach the nearest Metro Station off peak-time?,Hold on while I look for the required data,Yes
127,How long will it take from Brisk Lumbini Terrace Homes to reach the nearest Railway station at peak time?,Let me calculate that for you,Yes
128,How long will it take from Brisk Lumbini Terrace Homes to reach the nearest Railway station off peak time?,Please wait while I find out about the desired data,Yes
129,How long will it take from Brisk Lumbini Terrace Homes to reach Domestic Airport at peak time?,Let me find out the exact information for you,Yes
130,How long will it take from Brisk Lumbini Terrace Homes to reach Domestic Airport off peak time?,Hold on as I look up the required information,Yes
131,How long will it take from Brisk Lumbini Terrace Homes to reach the International Airport at peak time?,Watch the space below for the required information,Yes
132,How long will it take from Brisk Lumbini Terrace Homes to reach the International Airport off peak time?,Hold on as I look that up for you,Yes
133,How long will it take from Capital square to reach the nearest but stand?,Finding the best solution to your query...,Yes
134,What is the total land area covered by CHD Vann?,Hold on as I look for the required information,Yes
135,CHD Vann total area,Hold on as I look for the required information,Yes
136,How many towers does CHD tee9 have?,Give me a moment as I find that out for you,Yes
137,How many floors does each tower in CHD tee9 have?,Your choice of property furnishes the following information,Yes
138,How many lifts does each tower in CHD tee9 have?,Your choice of property furnishes the following data,Yes
139,Does CHD 106 Golf Avenue provide visitor car parking?,Let me look for information rearding the required service,Yes
140,How many car parkings does CHD 106 Golf Avenue provide?,Let me look for information rearding the required service,Yes
141,Does Chintels Serenity have a RWA?,Your society of choice provides the required service,Yes
142,Put me in touch with the RWA of Chintels Serenity,We do not provide that facility right now,No
143,Are there any good schools available inside Unitech Escape?,"Yes, let me look for the best options available.",Yes
144,Best schools around Unitech Escape,Looking for the required service near your location of choice..,Yes
145,What are the nearest schools around Unitech Escape?,The best options available of your choice of service are listed below.,Yes
146,How far is Unitech Escape from the nearest School?,Let me calculate that for you,Yes
147,How long will it take from Unitech Escape to reach the nearest School?,Calculating the time taken to travel from your chosen location to the nearest school,Yes
148,What are the most prominent schools available near Unitech Escape?,Let me show you a listing of the best options available of your choice of service.,Yes
149,Prominent schools around Unitech Escape,"Yes, let me show you the best options available of your choice of service.",Yes
150,Show me prominent Schools close to Unitech Escape,"Yes, let me look for the best options available.",Yes
151,Show me user ratings for Schools around Unitech Escape,,
152,I want to look for prominent schools around Unitech Escape,Let me show you a listing of the best options available of your choice of service.,Yes
153,Are there any good hospitals available inside Tulip Pelats?,"Yes, let me look for the best options available.",Yes
154,Best hospitals around Tulip Pelats,Looking for the required service near your location of choice..,Yes
155,What are the nearest hospitals or clinics around Tulip Pelats?,The best options available of your choice of service are listed below.,Yes
156,How far is Tulip Pelats from the nearest hospital?,Let me calculate that for you,Yes
157,How long will it take from Tulip Pelats to reach the nearest hospitals,Calculating the time taken to travel from your chosen location to the nearest hospital...,Yes
158,What are the most prominent hospitals available near Tulip Pelats?,Let me show you a listing of the best options available of your choice of service.,Yes
159,Prominent hospitals around Tulip Pelats,"Yes, let me show you the best options available of your choice of service.",Yes
160,Show me prominent medical care centers close to Tulip Pelats,"Yes, let me look for the best options available.",Yes
161,Show me user ratings for hospitals around Tulip Pelats,,
162,I want to look for prominent hospitals around Tulip Pelats,Let me show you a listing of the best options available of your choice of service.,Yes
163,Are there any good sports clubs available inside Unitech Harmony?,"Yes, let me look for the best options available.",Yes
164,Best recreational centers around Unitech Harmony,Looking for the required service near your location of choice..,Yes
165,What are the nearest sports or recreational centers around Unitech Harmony?,The best options available of your choice of service are listed below.,Yes
166,How far is Unitech Harmony from the nearest sports ground?,Let me calculate that for you,Yes
167,How long will it take from Unitech Harmony to reach the nearest recreational facility?,Calculating the time taken to travel from your chosen location to the nearest sportsrecreational facility...,Yes
168,What are the most prominent sports and recreational clubs available near Unitech Harmony?,Let me show you a listing of the best options available of your choice of service.,Yes
169,Prominent recreational facility around Unitech Harmony,"Yes, let me show you the best options available of your choice of service.",Yes
170,Show me prominent sports centers close to Unitech Harmony,"Yes, let me look for the best options available.",Yes
171,Show me user ratings for sports clubs around Unitech Harmony,,
172,I want to look for prominent sports and recreational means around Unitech Harmony,Let me show you a listing of the best options available of your choice of service.,Yes
173,What are the nearest malls available around BPTP Amstoria?,Showing you the best options available of your choice of service...,Yes
174,Best malls around BPTP Amstoria,Hold on as I enquire about your choice of service.,Yes
175,How far is BPTP Amstoria from the nearest mall?,Let me calculate the required distance for you.,Yes
176,What is the biggest mall near BPTP Amstoria?,Let me look that up for you,Yes
177,Find out the best place to shop at malls around BPTP Amstoria,Hold on as I look up the required information,Yes
178,I want see the nearest malls near BPTP Amstoria,Watch the space below for the required information,Yes
179,Are there any good malls available close to BPTP Amstoria,"Yes, Let me generate a listing of the best options available.",Yes
180,Can you look for malls available near BPTP Amstoria,"Yes, hold on while I present a list of the best options available to you.",Yes
181,I can’t find any malls around BPTP Amstoria,Let me help you with that.,Yes
182,How long will it take to reach the nearest mall from BPTP Amstoria,Calculating the time taken to travel from your chosen location to the nearest mall...,Yes
183,Prominent pre-schools around BPTP Spacio,"Yes, let me show you the best options available of your choice of service.",Yes
184,Show me prominent Pre Schools close to BPTP Spacio,"Yes, let me look for the best options available.",Yes
185,Show me user ratings for Pre Schools around BPTP Spacio,,
186,I want to look for prominent pre-schools around BPTP Spacio,Showing you the best options available of your choice of service.,Yes
187,Show me user ratings for Day Care Centers around BPTP Park Serene,,
188,I want to look for Day Care Centers near BPTP Park Serene,Hold on as I look up the required information,Yes
189,Show me prominent Day Care centers around BPTP Park Serene,"Yes, let me look for the best options available.",Yes
190,Nearest Day Care Centers around BPTP Park Serene,"Yes, Let me generate a listing of the best options available.",Yes
191,What are the nearest markets available around BPTP Amstoria?,"Yes, hold on while I present a list of the best options available to you.",Yes
192,Markets around BPTP Amstoria,Let me generate a listing of the best options available to aid your selection.,Yes
193,How far is BPTP Amstoria from the nearest market?,Calculating the desired information...,Yes
194,What is the biggest market near BPTP Amstoria?,Let me show you the best options available of your choice of service.,Yes
195,Find out the best place to shop around BPTP Amstoria,Showing you the best options available of your choice of service...,Yes
196,I want see the nearest shopping areas near BPTP Amstoria,Let me look for the best options available near your choice of location.,Yes
197,Are there any good markets available close to BPTP Amstoria,"Yes, let me show you the best options available of your choice of service.",Yes
198,Can you look for the markets available near BPTP Amstoria,Yes of course. Please wait while I generate the required information.,Yes
199,I can’t find any marts around BPTP Amstoria,Let me help you with that.,Yes
200,How long will it take to reach the nearest market from BPTP Amstoria,Calculating the time taken to travel from your chosen location to the nearest market...,Yes
201,Find out the best supermarkets around BPTP Amstoria,Showing you the best options available of your choice of service...,Yes
202,I want see the nearest supermarkets near BPTP Amstoria,Let me look for the best options available near your choice of location.,Yes
203,Are there any good supermarkets available close to BPTP Amstoria,"Yes, let me show you the best options available of your choice of service.",Yes
204,Can you look for the Supermarkets available near BPTP Amstoria,Yes of course. Please wait while I generate the required information.,Yes
205,I can’t find any supermarts around BPTP Amstoria,Let me help you with that.,Yes
206,How long will it take to reach the nearest supermarket from BPTP Amstoria,Calculating the time taken to travel from your chosen location to the nearest supermarket...,Yes
207,Show me the best salons available near BPTP Park Generations,Please wait while I generate the required information.,Yes
208,Can you find me the nearest salon from BPTP Park Generations?,"Yes, let me show you the best options available of your choice of service.",Yes
