S.No.,User_query,Bot_reply,Relevant
209,What are the nearest gyms available around Spaze Privy?,Let me look up the best options available of your choice of service.,Yes
210,Are there any gyms or spas available inside Spaze Privy?,"Yes, let me show you a listing of the best options available of your choice of service.",Yes
211,Show me user reviews for gyms available inside Spaze Privy.,,Yes
212,Best gyms near Spaze Privy.,Let me search for the required information,Yes
213,Show me the best gyms available near Spaze Privy,Please wait while I generate the required information.,Yes
214,Can you find me the nearest gym and spa from Spaze Privy?,"Yes, let me show you the best options available of your choice of service.",Yes
215,Can you help me locate the nearest medical shop near BPTP Terra Residents,"Certainly, let me look up the best options available of your choice of service.",Yes
216,How far is the nearest medical shop from BPTP Terra Residents,Let me calculate the required distance for you.,Yes
217,Show me the number of pharmacies provided inside BPTP Terra Residents,Hold on as I enquire about your choice of service.,Yes
218,Is Roofpik associated with Zomato?,"No, Roofpik is an independent organization that is here to help you with real estate.",Yes
219,Can you help me find the top rated restaurants around BPTP Chateau?,"Yes, let me show you a listing of the best options available of your choice of service.",Yes
220,Does BPTP Chateue provide fine dining options inside the society?,Let me quickly look that up for you,Yes
221,Can you help me locate the nearest fire station to BPTP Park Prime Mansions?,"Certainly, hold on as I find that out for you",Yes
222,Contact details of the nearest fire station from BPTP Park Prime Mansions,Let me furnish that information for you,Yes
223,Metro station from Earth Copia,Looking for the required service near your location of choice.,Yes
224,How quickly can I get to the metro station from Earth Copia at peak time?,Let me calculate that for you,Yes
225,How quickly can I get to the metro station from Earth Copia off peak time?,Calculating the desired information...,Yes
226,Can you help me look for the closest metro station from Earth Copia?,"Yes, let me find out the exact information for you",Yes
227,Find nearest Metro Station from Earth Copia,Hold on as I look up the required information,Yes
228,Locate closest Metro Station from Earth Copia,Let me locate the service required by you.,Yes
229,I want to take the metro closest to Earth Copia,Hold on while I look for the required data,Yes
230,Nearest metro service from Earth Copia,Let me show you the best option available,Yes
231,Shortest route to the nearest metro line from Earth Copia at peak time,Finding the best solution to your query...,Yes
232,Railway station from DLF Primus,Looking for the required service near your location of choice.,Yes
233,How quickly can I get to NDLS railway station from DLF Primus at peak time?,Let me calculate that for you,Yes
234,How quickly can I get to the NZM railway station from DLF Primus off peak time?,Calculating the desired information...,Yes
235,Can you help me look for the closest railway station from DLF Primus?,"Yes, let me find out the exact information for you",Yes
236,Find nearest Railway Station from DLF Primus,Hold on as I look up the required information,Yes
237,Locate closest Railway Station from DLF Primus,Let me locate the service required by you.,Yes
238,I want to go to the Railway Station closest to DLF Primus,Hold on while I look for the required data,Yes
239,Nearest railway station from DLF Primus,Let me show you the best option available,Yes
240,Shortest route to the nearest railway station from DLF Primus at peak time,Finding the best solution to your query...,Yes
241,Domestic Airport from Ireo Skyon,Looking for the required service near your location of choice.,Yes
242,How quickly can I get to Domestic Airport from Ireo Skyon at peak time?,Let me calculate that for you,Yes
243,How quickly can I get to the Domestic Airport from Ireo Skyon off peak time?,Calculating the desired information...,Yes
244,Can you help me look for the Domestic Airport from Ireo Skyon?,"Yes, let me find out the exact information for you",Yes
245,Find Domestic Airport from Ireo Skyon,Hold on as I look up the required information,Yes
246,Locate Domestic Airport from Ireo Skyon,Let me locate the service required by you.,Yes
247,I want to go to the Domestic Airport closest to Ireo Skyon,Let me help you with that.,Yes
248,Shortest route to the DomesticAirport from Ireo Skyon at peak time,Finding the best solution to your query...,Yes
249,International Airport from Ireo Skyon,Looking for the required service near your location of choice.,Yes
250,How quickly can I get to International Airport from Ireo Skyon at peak time?,Let me calculate that for you,Yes
251,How quickly can I get to the International Airport from Ireo Skyon off peak time?,Calculating the desired information...,Yes
252,Can you help me look for the International Airport from Ireo Skyon?,"Yes, let me find out the exact information for you",Yes
253,Find International Airport from Ireo Skyon,Hold on as I look up the required information,Yes
254,Locate International Airport from Ireo Skyon,Let me locate the service required by you.,Yes
255,I want to go to the Int. Airport closest to Ireo Skyon,Let me help you with that.,Yes
256,Shortest route to the Int. Airport from Ireo Skyon at peak time,Finding the best solution to your query...,Yes
257,Bus station from Paras Dews,Looking for the required service near your location of choice.,Yes
258,How quickly can I get to the Bus station from Paras Dews at peak time?,Let me calculate that for you,Yes
259,How quickly can I get to the Bus station from Paras Dews off peak time?,Calculating the desired information...,Yes
260,Can you help me look for the closest Bus station from Paras Dews?,"Yes, let me find out the exact information for you",Yes
261,Find nearest Bus Station from Paras Dews,Hold on as I look up the required information,Yes
262,Locate closest Bus Station from Paras Dews,Let me locate the service required by you.,Yes
263,I want to take the Bus closest to Paras Dews,Let me help you with that.,Yes
264,Nearest Bus service from Paras Dews,Let me show you the best option available,Yes
265,Shortest route to the nearest Bus line from Paras Dews at peak time,Finding the best solution to your query...,Yes
